{
  "$schema": "http://json-schema.org/draft-04/schema#",
  "type": "object",
  "properties": {
    "url": {
      "type": "string"
    },
    "created_date": {
      "type": "string"
    },
    "congress": {
      "type": "integer"
    },
    "session": {
      "type": "integer"
    },
    "report_date": {
      "type": "string"
    },
    "legislative_activity": {
      "type": "object",
      "properties": {
        "start_date": {
          "type": "string"
        },
        "end_date": {
          "type": "string"
        },
        "senate": {
          "type": "object",
          "properties": {
            "days_in_session": {
              "type": "integer"
            },
            "time_in_session": {
              "type": "string"
            },
            "congressional_record": {
              "type": "object",
              "properties": {
                "pages_of_proceedings": {
                  "type": "integer"
                }
              },
              "required": [
                "pages_of_proceedings"
              ]
            },
            "public_bills_enacted_into_law": {
              "type": "integer"
            },
            "measures_passed_total": {
              "type": "object",
              "properties": {
                "total": {
                  "type": "integer"
                },
                "senate_bills": {
                  "type": "integer"
                },
                "house_bills": {
                  "type": "integer"
                },
                "senate_joint_resolutions": {
                  "type": "integer"
                },
                "house_joint_resolutions": {
                  "type": "integer"
                },
                "senate_concurrent_resolutions": {
                  "type": "integer"
                },
                "house_concurrent_resolutions": {
                  "type": "integer"
                },
                "simple_resolutions": {
                  "type": "integer"
                }
              },
              "required": [
                "total",
                "senate_bills",
                "house_bills",
                "senate_joint_resolutions",
                "house_joint_resolutions",
                "senate_concurrent_resolutions",
                "house_concurrent_resolutions",
                "simple_resolutions"
              ]
            },
            "measures_reported_total": {
              "type": "object",
              "properties": {
                "total": {
                  "type": "integer"
                },
                "senate_bills": {
                  "type": "integer"
                },
                "house_bills": {
                  "type": "integer"
                },
                "senate_joint_resolutions": {
                  "type": "integer"
                },
                "simple_resolutions": {
                  "type": "integer"
                }
              },
              "required": [
                "total",
                "senate_bills",
                "house_bills",
                "senate_joint_resolutions",
                "simple_resolutions"
              ]
            },
            "special_reports": {
              "type": "integer"
            },
            "measures_pending_on_calendar": {
              "type": "integer",
              "optional": true
            },
            "measures_introduced_total": {
              "type": "object",
              "properties": {
                "total": {
                  "type": "integer"
                },
                "bills": {
                  "type": "integer"
                },
                "joint_resolutions": {
                  "type": "integer"
                },
                "concurrent_resolutions": {
                  "type": "integer"
                },
                "simple_resolutions": {
                  "type": "integer"
                }
              },
              "required": [
                "total",
                "bills",
                "joint_resolutions",
                "concurrent_resolutions",
                "simple_resolutions"
              ]
            },
            "quorum_calls": {
              "type": "integer"
            },
            "yea_and_nay_votes": {
              "type": "integer"
            }
          },
          "required": [
            "days_in_session",
            "time_in_session",
            "congressional_record",
            "public_bills_enacted_into_law",
            "measures_passed_total",
            "measures_reported_total",
            "special_reports",
            "measures_introduced_total",
            "quorum_calls",
            "yea_and_nay_votes"
          ]
        },
        "house": {
          "type": "object",
          "properties": {
            "days_in_session": {
              "type": "integer"
            },
            "time_in_session": {
              "type": "string"
            },
            "congressional_record": {
              "type": "object",
              "properties": {
                "pages_of_proceedings": {
                  "type": "integer"
                },
                "extensions_of_remarks": {
                  "type": "integer",
                  "optional": true
                }
              },
              "required": [
                "pages_of_proceedings"
              ]
            },
            "public_bills_enacted_into_law": {
              "type": "integer"
            },
            "measures_passed_total": {
              "type": "object",
              "properties": {
                "total": {
                  "type": "integer"
                },
                "senate_bills": {
                  "type": "integer"
                },
                "house_bills": {
                  "type": "integer"
                },
                "senate_joint_resolutions": {
                  "type": "integer"
                },
                "house_joint_resolutions": {
                  "type": "integer"
                },
                "senate_concurrent_resolutions": {
                  "type": "integer"
                },
                "house_concurrent_resolutions": {
                  "type": "integer"
                },
                "simple_resolutions": {
                  "type": "integer"
                }
              },
              "required": [
                "total",
                "senate_bills",
                "house_bills",
                "senate_joint_resolutions",
                "house_joint_resolutions",
                "senate_concurrent_resolutions",
                "house_concurrent_resolutions",
                "simple_resolutions"
              ]
            },
            "measures_reported_total": {
              "type": "object",
              "properties": {
                "total": {
                  "type": "integer"
                },
                "house_bills": {
                  "type": "integer"
                },
                "house_joint_resolutions": {
                  "type": "integer"
                },
                "simple_resolutions": {
                  "type": "integer"
                }
              },
              "required": [
                "total",
                "house_bills",
                "house_joint_resolutions",
                "simple_resolutions"
              ]
            },
            "special_reports": {
              "type": "integer"
            },
            "measures_pending_on_calendar": {
              "type": "integer",
              "optional": true
            },
            "measures_introduced_total": {
              "type": "object",
              "properties": {
                "total": {
                  "type": "integer"
                },
                "bills": {
                  "type": "integer"
                },
                "joint_resolutions": {
                  "type": "integer"
                },
                "concurrent_resolutions": {
                  "type": "integer"
                },
                "simple_resolutions": {
                  "type": "integer"
                }
              },
              "required": [
                "total",
                "bills",
                "joint_resolutions",
                "concurrent_resolutions",
                "simple_resolutions"
              ]
            },
            "quorum_calls": {
              "type": "integer"
            },
            "yea_and_nay_votes": {
              "type": "integer"
            }
          },
          "required": [
            "days_in_session",
            "time_in_session",
            "congressional_record",
            "public_bills_enacted_into_law",
            "measures_passed_total",
            "measures_reported_total",
            "special_reports",
            "measures_introduced_total",
            "quorum_calls",
            "yea_and_nay_votes"
          ]
        },
        "total": {
          "type": "object",
          "properties": {
            "measures_passed_total": {
              "type": "object",
              "properties": {
                "total": {
                  "type": "integer",
                  "optional": true
                }
              }
            },
            "measures_reported_total": {
              "type": "object",
              "properties": {
                "total": {
                  "type": "integer",
                  "optional": true
                }
              }
            },
            "measures_introduced_total": {
              "type": "object",
              "properties": {
                "total": {
                  "type": "integer",
                  "optional": true
                }
              }
            }
          },
          "required": [
            "measures_passed_total",
            "measures_reported_total",
            "measures_introduced_total"
          ]
        }
      },
      "required": [
        "start_date",
        "end_date",
        "senate",
        "house",
        "total"
      ]
    },
    "disposition_of_executive_nominations": {
      "type": "object",
      "properties": {
        "start_date": {
          "type": "string"
        },
        "end_date": {
          "type": "string"
        },
        "civilian_nominees": {
          "type": "object",
          "properties": {
            "total": {
              "type": "integer"
            },
            "disposition": {
              "type": "object",
              "properties": {
                "confirmed": {
                  "type": "integer"
                },
                "unconfirmed": {
                  "type": "integer"
                },
                "withdrawn": {
                  "type": "integer"
                }
              },
              "required": [
                "confirmed",
                "unconfirmed",
                "withdrawn"
              ]
            }
          },
          "required": [
            "total",
            "disposition"
          ]
        },
        "other_civilian_nominees": {
          "type": "object",
          "properties": {
            "total": {
              "type": "integer"
            },
            "disposition": {
              "type": "object",
              "properties": {
                "confirmed": {
                  "type": "integer"
                },
                "unconfirmed": {
                  "type": "integer"
                }
              },
              "required": [
                "confirmed",
                "unconfirmed"
              ]
            }
          },
          "required": [
            "total",
            "disposition"
          ]
        },
        "air_force_nominees": {
          "type": "object",
          "properties": {
            "total": {
              "type": "integer"
            },
            "disposition": {
              "type": "object",
              "properties": {
                "confirmed": {
                  "type": "integer"
                },
                "unconfirmed": {
                  "type": "integer"
                }
              },
              "required": [
                "confirmed",
                "unconfirmed"
              ]
            }
          },
          "required": [
            "total",
            "disposition"
          ]
        },
        "army_nominees": {
          "type": "object",
          "properties": {
            "total": {
              "type": "integer"
            },
            "disposition": {
              "type": "object",
              "properties": {
                "confirmed": {
                  "type": "integer"
                },
                "unconfirmed": {
                  "type": "integer"
                },
                "withdrawn": {
                  "type": "integer"
                }
              },
              "required": [
                "confirmed",
                "unconfirmed",
                "withdrawn"
              ]
            }
          },
          "required": [
            "total",
            "disposition"
          ]
        },
        "navy_nominees": {
          "type": "object",
          "properties": {
            "total": {
              "type": "integer"
            },
            "disposition": {
              "type": "object",
              "properties": {
                "confirmed": {
                  "type": "integer"
                },
                "unconfirmed": {
                  "type": "integer"
                },
                "withdrawn": {
                  "type": "integer",
                  "optional": true
                }
              },
              "required": [
                "confirmed",
                "unconfirmed",
                "withdrawn"
              ]
            }
          },
          "required": [
            "total",
            "disposition"
          ]
        },
        "marine_corps_nominees": {
          "type": "object",
          "properties": {
            "total": {
              "type": "integer"
            },
            "disposition": {
              "type": "object",
              "properties": {
                "confirmed": {
                  "type": "integer"
                },
                "unconfirmed": {
                  "type": "integer"
                }
              },
              "required": [
                "confirmed",
                "unconfirmed"
              ]
            }
          },
          "required": [
            "total",
            "disposition"
          ]
        },
        "space_force_nominees": {
          "type": "object",
          "properties": {
            "total": {
              "type": "integer"
            },
            "disposition": {
              "type": "object",
              "properties": {
                "confirmed": {
                  "type": "integer"
                },
                "unconfirmed": {
                  "type": "integer"
                },
                "withdrawn": {
                  "type": "integer"
                }
              },
              "required": [
                "confirmed",
                "unconfirmed",
                "withdrawn"
              ]
            }
          },
          "required": [
            "total",
            "disposition"
          ]
        },
        "summary": {
          "type": "object",
          "properties": {
            "total_nominees_received_this_session": {
              "type": "integer"
            },
            "total_confirmed": {
              "type": "integer"
            },
            "total_unconfirmed": {
              "type": "integer"
            },
            "total_withdrawn": {
              "type": "integer"
            },
            "total_returned_to_white_house": {
              "type": "integer"
            }
          },
          "required": [
            "total_nominees_received_this_session",
            "total_confirmed",
            "total_unconfirmed",
            "total_withdrawn",
            "total_returned_to_white_house"
          ]
        }
      },
      "required": [
        "start_date",
        "end_date",
        "civilian_nominees",
        "army_nominees",
        "navy_nominees",
        "marine_corps_nominees",
        "space_force_nominees",
        "summary"
      ]
    },
    "footnote": {
      "type": "object",
      "properties": {
        "resume.legislative_activity.senate.measures_reported_total.total": {
          "type": "string"
        }
      },
      "required": [
        "resume.legislative_activity.senate.measures_reported_total.total"
      ]
    }
  },
  "required": [
    "url",
    "created_date",
    "congress",
    "session",
    "report_date",
    "legislative_activity",
    "disposition_of_executive_nominations",
    "footnote"
  ]
}